,screen_name,username,user_id,tweet_id,tweet_url,timestamp,timestamp_epochs,text,text_html,links,hashtags,has_media,img_urls,video_url,likes,retweets,replies,is_replied,is_reply_to,parent_tweet_id,reply_to_users
129,CNN,CNN,759251,1238250919524958209,/CNN/status/1238250919524958209,2020-03-12 23:49:59,1584056999,Kentucky Gov. Andy Beshear has recommended that all public and private schools throughout the commonwealth cease in-person classes for at least two weeks due to concerns over the coronavirus outbreak https://cnn.it/38LK0cn pic.twitter.com/SZgXGp96Qf,"<p class=""TweetTextSize js-tweet-text tweet-text"" data-aria-label-part=""0"" lang=""en"">Kentucky Gov. Andy Beshear has recommended that all public and private schools throughout the commonwealth cease in-person classes for at least two weeks due to concerns over the <strong>coronavirus</strong> outbreak <a class=""twitter-timeline-link"" data-expanded-url=""https://cnn.it/38LK0cn"" dir=""ltr"" href=""https://t.co/0LIYL5MjlQ"" rel=""nofollow noopener"" target=""_blank"" title=""https://cnn.it/38LK0cn""><span class=""tco-ellipsis""></span><span class=""invisible"">https://</span><span class=""js-display-url"">cnn.it/38LK0cn</span><span class=""invisible""></span><span class=""tco-ellipsis""><span class=""invisible""> </span></span></a><a class=""twitter-timeline-link u-hidden"" data-pre-embedded=""true"" dir=""ltr"" href=""https://t.co/SZgXGp96Qf"">pic.twitter.com/SZgXGp96Qf</a></p>",['https://cnn.it/38LK0cn'],[],True,['https://pbs.twimg.com/media/ES8mpfLWkAcnlm4.png'],,351,123,25,True,False,,[]
130,CNN,CNN,759251,1238249538323963904,/CNN/status/1238249538323963904,2020-03-12 23:44:30,1584056670,"Utah is banning mass gatherings of over 100 people for two weeks starting next Monday due to coronavirus concerns. Gov. Herbert says the ban – which includes houses of worship – doesn't apply to K-12 schools, but districts were asked “to prepare to close.” https://cnn.it/33ls4Es pic.twitter.com/i3Dy7uhlVl","<p class=""TweetTextSize js-tweet-text tweet-text"" data-aria-label-part=""0"" lang=""en"">Utah is banning mass gatherings of over 100 people for two weeks starting next Monday due to <strong>coronavirus</strong> concerns. Gov. Herbert says the ban – which includes houses of worship – doesn't apply to K-12 schools, but districts were asked “to prepare to close.” <a class=""twitter-timeline-link"" data-expanded-url=""https://cnn.it/33ls4Es"" dir=""ltr"" href=""https://t.co/BpCQ5imCdM"" rel=""nofollow noopener"" target=""_blank"" title=""https://cnn.it/33ls4Es""><span class=""tco-ellipsis""></span><span class=""invisible"">https://</span><span class=""js-display-url"">cnn.it/33ls4Es</span><span class=""invisible""></span><span class=""tco-ellipsis""><span class=""invisible""> </span></span></a><a class=""twitter-timeline-link u-hidden"" data-pre-embedded=""true"" dir=""ltr"" href=""https://t.co/i3Dy7uhlVl"">pic.twitter.com/i3Dy7uhlVl</a></p>",['https://cnn.it/33ls4Es'],[],True,['https://pbs.twimg.com/media/ES8lZGdXYAENfwl.png'],,332,118,39,True,False,,[]
131,CNN,CNN,759251,1238247667718914051,/CNN/status/1238247667718914051,2020-03-12 23:37:04,1584056224,"World Wrestling Entertainment announced that its weekly event, SmackDown, will move to the WWE Performance Center in Orlando, and that the show will be performed sans fans amid coronavirus concerns https://cnn.it/39LPMMx ","<p class=""TweetTextSize js-tweet-text tweet-text"" data-aria-label-part=""0"" lang=""en"">World Wrestling Entertainment announced that its weekly event, SmackDown, will move to the WWE Performance Center in Orlando, and that the show will be performed sans fans amid <strong>coronavirus</strong> concerns <a class=""twitter-timeline-link u-hidden"" data-expanded-url=""https://cnn.it/39LPMMx"" dir=""ltr"" href=""https://t.co/Y5zn4Ay1Zn"" rel=""nofollow noopener"" target=""_blank"" title=""https://cnn.it/39LPMMx""><span class=""tco-ellipsis""></span><span class=""invisible"">https://</span><span class=""js-display-url"">cnn.it/39LPMMx</span><span class=""invisible""></span><span class=""tco-ellipsis""><span class=""invisible""> </span></span></a></p>",['https://cnn.it/39LPMMx'],[],False,[],,524,231,74,True,False,,[]
132,CNN,CNN,759251,1238246976417923075,/CNN/status/1238246976417923075,2020-03-12 23:34:19,1584056059,"CNN readers ask sharp questions about coronavirus every day. Here are some of the most popular recent questions, answered. https://cnn.it/2W4Icsl ","<p class=""TweetTextSize js-tweet-text tweet-text"" data-aria-label-part=""0"" lang=""en"">CNN readers ask sharp questions about <strong>coronavirus</strong> every day. Here are some of the most popular recent questions, answered. <a class=""twitter-timeline-link u-hidden"" data-expanded-url=""https://cnn.it/2W4Icsl"" dir=""ltr"" href=""https://t.co/COv4lUq7NY"" rel=""nofollow noopener"" target=""_blank"" title=""https://cnn.it/2W4Icsl""><span class=""tco-ellipsis""></span><span class=""invisible"">https://</span><span class=""js-display-url"">cnn.it/2W4Icsl</span><span class=""invisible""></span><span class=""tco-ellipsis""><span class=""invisible""> </span></span></a></p>",['https://cnn.it/2W4Icsl'],[],False,[],,198,73,26,True,False,,[]
133,CNN,CNN,759251,1238243740936032256,/CNN/status/1238243740936032256,2020-03-12 23:21:27,1584055287,"A significant part of Fox News' coverage has been aimed toward framing the response to coronavirus as unwarranted hysteria, writes @oliverdarcy | Analysishttps://cnn.it/2W7RUdn ","<p class=""TweetTextSize js-tweet-text tweet-text"" data-aria-label-part=""0"" lang=""en"">A significant part of Fox News' coverage has been aimed toward framing the response to <strong>coronavirus</strong> as unwarranted hysteria, writes <a class=""twitter-atreply pretty-link js-nav"" data-mentioned-user-id=""27075032"" dir=""ltr"" href=""/oliverdarcy""><s>@</s><b>oliverdarcy</b></a> | Analysis<a class=""twitter-timeline-link u-hidden"" data-expanded-url=""https://cnn.it/2W7RUdn"" dir=""ltr"" href=""https://t.co/LmQtDYT9Nm"" rel=""nofollow noopener"" target=""_blank"" title=""https://cnn.it/2W7RUdn""><span class=""tco-ellipsis""></span><span class=""invisible"">https://</span><span class=""js-display-url"">cnn.it/2W7RUdn</span><span class=""invisible""></span><span class=""tco-ellipsis""><span class=""invisible""> </span></span></a></p>",['https://cnn.it/2W7RUdn'],[],False,[],,1058,410,328,True,False,,[]
134,CNN,CNN,759251,1238240141510090761,/CNN/status/1238240141510090761,2020-03-12 23:07:09,1584054429,Democratic Rep. Katie Porter pressed the CDC chief during a congressional hearing to agree that the agency will pay for testing for the novel coronavirus https://cnn.it/3aOWmBL ,"<p class=""TweetTextSize js-tweet-text tweet-text"" data-aria-label-part=""0"" lang=""en"">Democratic Rep. Katie Porter pressed the CDC chief during a congressional hearing to agree that the agency will pay for testing for the novel <strong>coronavirus</strong> <a class=""twitter-timeline-link u-hidden"" data-expanded-url=""https://cnn.it/3aOWmBL"" dir=""ltr"" href=""https://t.co/ij7iTyvYpu"" rel=""nofollow noopener"" target=""_blank"" title=""https://cnn.it/3aOWmBL""><span class=""tco-ellipsis""></span><span class=""invisible"">https://</span><span class=""js-display-url"">cnn.it/3aOWmBL</span><span class=""invisible""></span><span class=""tco-ellipsis""><span class=""invisible""> </span></span></a></p>",['https://cnn.it/3aOWmBL'],[],False,[],,7306,1239,169,True,False,,[]
135,CNN,CNN,759251,1238238657011744770,/CNN/status/1238238657011744770,2020-03-12 23:01:15,1584054075,"After President Trump's address on coronavirus, how can Joe Biden and Bernie Sanders make the pitch to voters that they are the right candidate to tackle the challenge? Listen to the latest #TheDailyDC podcast for analysis https://cnn.it/2QebL74 pic.twitter.com/AgmCl6dEmZ","<p class=""TweetTextSize js-tweet-text tweet-text"" data-aria-label-part=""0"" lang=""en"">After President Trump's address on <strong>coronavirus</strong>, how can Joe Biden and Bernie Sanders make the pitch to voters that they are the right candidate to tackle the challenge? Listen to the latest <a class=""twitter-hashtag pretty-link js-nav"" data-query-source=""hashtag_click"" dir=""ltr"" href=""/hashtag/TheDailyDC?src=hash""><s>#</s><b>TheDailyDC</b></a> podcast for analysis <a class=""twitter-timeline-link"" data-expanded-url=""https://cnn.it/2QebL74"" dir=""ltr"" href=""https://t.co/0VFjh9IIRC"" rel=""nofollow noopener"" target=""_blank"" title=""https://cnn.it/2QebL74""><span class=""tco-ellipsis""></span><span class=""invisible"">https://</span><span class=""js-display-url"">cnn.it/2QebL74</span><span class=""invisible""></span><span class=""tco-ellipsis""><span class=""invisible""> </span></span></a><a class=""twitter-timeline-link u-hidden"" data-pre-embedded=""true"" dir=""ltr"" href=""https://t.co/AgmCl6dEmZ"">pic.twitter.com/AgmCl6dEmZ</a></p>",['https://cnn.it/2QebL74'],['TheDailyDC'],True,['https://pbs.twimg.com/media/ES8bfsGWoAA0J8m.jpg'],,129,29,59,True,False,,[]
136,CNN,CNN,759251,1238233514534932481,/CNN/status/1238233514534932481,2020-03-12 22:40:49,1584052849,"More and more of the world is working from home as coronavirus spreads — and so is Canadian PM Justin Trudeau, who is trying to run his country in self-isolation as his wife, Sophie Grégoire Trudeau, awaits coronavirus test results, his office confirms https://cnn.it/2vhAgsB ","<p class=""TweetTextSize js-tweet-text tweet-text"" data-aria-label-part=""0"" lang=""en"">More and more of the world is working from home as <strong>coronavirus</strong> spreads — and so is Canadian PM Justin Trudeau, who is trying to run his country in self-isolation as his wife, Sophie Grégoire Trudeau, awaits <strong>coronavirus</strong> test results, his office confirms <a class=""twitter-timeline-link u-hidden"" data-expanded-url=""https://cnn.it/2vhAgsB"" dir=""ltr"" href=""https://t.co/Ed7A0UNeVw"" rel=""nofollow noopener"" target=""_blank"" title=""https://cnn.it/2vhAgsB""><span class=""tco-ellipsis""></span><span class=""invisible"">https://</span><span class=""js-display-url"">cnn.it/2vhAgsB</span><span class=""invisible""></span><span class=""tco-ellipsis""><span class=""invisible""> </span></span></a></p>",['https://cnn.it/2vhAgsB'],[],False,[],,687,230,55,True,False,,[]
137,CNN,CNN,759251,1238229395803955202,/CNN/status/1238229395803955202,2020-03-12 22:24:27,1584051867,"A new study details the first known transmission of novel coronavirus in the United States, and suggests that the virus may transmit most easily through extended contact with infected people, not brief or casual exposures https://cnn.it/33iv5oP ","<p class=""TweetTextSize js-tweet-text tweet-text"" data-aria-label-part=""0"" lang=""en"">A new study details the first known transmission of novel <strong>coronavirus</strong> in the United States, and suggests that the virus may transmit most easily through extended contact with infected people, not brief or casual exposures <a class=""twitter-timeline-link"" data-expanded-url=""https://cnn.it/33iv5oP"" dir=""ltr"" href=""https://t.co/SmhSyGyBFh"" rel=""nofollow noopener"" target=""_blank"" title=""https://cnn.it/33iv5oP""><span class=""tco-ellipsis""></span><span class=""invisible"">https://</span><span class=""js-display-url"">cnn.it/33iv5oP</span><span class=""invisible""></span><span class=""tco-ellipsis""><span class=""invisible""> </span></span></a></p>",['https://cnn.it/33iv5oP'],[],False,[],,886,361,97,True,False,,[]
138,CNN,CNN,759251,1238224738385833988,/CNN/status/1238224738385833988,2020-03-12 22:05:57,1584050757,"New York state will have the first public drive-through coronavirus testing facility on the east coast, Gov. Andrew Cuomo announced https://cnn.it/33cdXky pic.twitter.com/TNiUqOGGMf","<p class=""TweetTextSize js-tweet-text tweet-text"" data-aria-label-part=""0"" lang=""en"">New York state will have the first public drive-through <strong>coronavirus</strong> testing facility on the east coast, Gov. Andrew Cuomo announced <a class=""twitter-timeline-link"" data-expanded-url=""https://cnn.it/33cdXky"" dir=""ltr"" href=""https://t.co/hQDs2vuZan"" rel=""nofollow noopener"" target=""_blank"" title=""https://cnn.it/33cdXky""><span class=""tco-ellipsis""></span><span class=""invisible"">https://</span><span class=""js-display-url"">cnn.it/33cdXky</span><span class=""invisible""></span><span class=""tco-ellipsis""><span class=""invisible""> </span></span></a><a class=""twitter-timeline-link u-hidden"" data-pre-embedded=""true"" dir=""ltr"" href=""https://t.co/TNiUqOGGMf"">pic.twitter.com/TNiUqOGGMf</a></p>",['https://cnn.it/33cdXky'],[],True,['https://pbs.twimg.com/media/ES8O1k2WsAAvzYa.png'],,1165,322,51,True,False,,[]
139,CNN,CNN,759251,1238223324280492036,/CNN/status/1238223324280492036,2020-03-12 22:00:20,1584050420,"CNN is collecting your questions and stories about coronavirus. We'll be answering some of them in upcoming stories.

Submit them here: https://cnn.it/2wUJuM4 pic.twitter.com/QoCYD7kTkj","<p class=""TweetTextSize js-tweet-text tweet-text"" data-aria-label-part=""0"" lang=""en"">CNN is collecting your questions and stories about <strong>coronavirus</strong>. We'll be answering some of them in upcoming stories.

Submit them here: <a class=""twitter-timeline-link"" data-expanded-url=""https://cnn.it/2wUJuM4"" dir=""ltr"" href=""https://t.co/twQWxOUJmS"" rel=""nofollow noopener"" target=""_blank"" title=""https://cnn.it/2wUJuM4""><span class=""tco-ellipsis""></span><span class=""invisible"">https://</span><span class=""js-display-url"">cnn.it/2wUJuM4</span><span class=""invisible""></span><span class=""tco-ellipsis""><span class=""invisible""> </span></span></a><a class=""twitter-timeline-link u-hidden"" data-pre-embedded=""true"" dir=""ltr"" href=""https://t.co/QoCYD7kTkj"">pic.twitter.com/QoCYD7kTkj</a></p>",['https://cnn.it/2wUJuM4'],[],True,['https://pbs.twimg.com/media/ES8NjSpWkAAomnt.jpg'],,168,37,58,True,False,,[]
140,CNN,CNN,759251,1238221885822959624,/CNN/status/1238221885822959624,2020-03-12 21:54:37,1584050077,New York City declared a state of emergency and the state banned large gatherings as officials took more aggressive actions to stem the coronavirus pandemic https://cnn.it/38LiStV ,"<p class=""TweetTextSize js-tweet-text tweet-text"" data-aria-label-part=""0"" lang=""en"">New York City declared a state of emergency and the state banned large gatherings as officials took more aggressive actions to stem the <strong>coronavirus</strong> pandemic <a class=""twitter-timeline-link u-hidden"" data-expanded-url=""https://cnn.it/38LiStV"" dir=""ltr"" href=""https://t.co/xYKuCD4cVE"" rel=""nofollow noopener"" target=""_blank"" title=""https://cnn.it/38LiStV""><span class=""tco-ellipsis""></span><span class=""invisible"">https://</span><span class=""js-display-url"">cnn.it/38LiStV</span><span class=""invisible""></span><span class=""tco-ellipsis""><span class=""invisible""> </span></span></a></p>",['https://cnn.it/38LiStV'],[],False,[],,516,205,43,True,False,,[]
141,CNN,CNN,759251,1238221068013371393,/CNN/status/1238221068013371393,2020-03-12 21:51:22,1584049882,"Coronavirus is spreading, and so is misinformation about it.

 Get the facts in your inbox: https://cnn.it/33oOiFH 
 Listen to Dr. Sanjay Gupta's podcast: https://cnn.it/2xyVuDa 
 Get mobile alerts: https://cnn.it/2WaEkFZ 
 Ask a question: https://cnn.it/33de27H pic.twitter.com/ZIXRuSbS6L","<p class=""TweetTextSize js-tweet-text tweet-text"" data-aria-label-part=""0"" lang=""en""><strong>Coronavirus</strong> is spreading, and so is misinformation about it.

<img alt=""✉️"" aria-label=""Emoji: Sobre"" class=""Emoji Emoji--forText"" draggable=""false"" src=""https://abs.twimg.com/emoji/v2/72x72/2709.png"" title=""Sobre""/> Get the facts in your inbox: <a class=""twitter-timeline-link"" data-expanded-url=""https://cnn.it/33oOiFH"" dir=""ltr"" href=""https://t.co/l0pPUfC8mg"" rel=""nofollow noopener"" target=""_blank"" title=""https://cnn.it/33oOiFH""><span class=""tco-ellipsis""></span><span class=""invisible"">https://</span><span class=""js-display-url"">cnn.it/33oOiFH</span><span class=""invisible""></span><span class=""tco-ellipsis""><span class=""invisible""> </span></span></a>
<img alt=""🔉"" aria-label=""Emoji: Altavoz con una onda de sonido"" class=""Emoji Emoji--forText"" draggable=""false"" src=""https://abs.twimg.com/emoji/v2/72x72/1f509.png"" title=""Altavoz con una onda de sonido""/> Listen to Dr. Sanjay Gupta's podcast: <a class=""twitter-timeline-link"" data-expanded-url=""https://cnn.it/2xyVuDa"" dir=""ltr"" href=""https://t.co/uSmczzZRyS"" rel=""nofollow noopener"" target=""_blank"" title=""https://cnn.it/2xyVuDa""><span class=""tco-ellipsis""></span><span class=""invisible"">https://</span><span class=""js-display-url"">cnn.it/2xyVuDa</span><span class=""invisible""></span><span class=""tco-ellipsis""><span class=""invisible""> </span></span></a>
<img alt=""📲"" aria-label=""Emoji: Teléfono móvil con flecha de izquierda a derecha"" class=""Emoji Emoji--forText"" draggable=""false"" src=""https://abs.twimg.com/emoji/v2/72x72/1f4f2.png"" title=""Teléfono móvil con flecha de izquierda a derecha""/> Get mobile alerts: <a class=""twitter-timeline-link"" data-expanded-url=""https://cnn.it/2WaEkFZ"" dir=""ltr"" href=""https://t.co/jbQsBOZFc6"" rel=""nofollow noopener"" target=""_blank"" title=""https://cnn.it/2WaEkFZ""><span class=""tco-ellipsis""></span><span class=""invisible"">https://</span><span class=""js-display-url"">cnn.it/2WaEkFZ</span><span class=""invisible""></span><span class=""tco-ellipsis""><span class=""invisible""> </span></span></a>
<img alt=""➡️"" aria-label=""Emoji: Flecha hacia la derecha"" class=""Emoji Emoji--forText"" draggable=""false"" src=""https://abs.twimg.com/emoji/v2/72x72/27a1.png"" title=""Flecha hacia la derecha""/> Ask a question: <a class=""twitter-timeline-link"" data-expanded-url=""https://cnn.it/33de27H"" dir=""ltr"" href=""https://t.co/cWASEA3jqi"" rel=""nofollow noopener"" target=""_blank"" title=""https://cnn.it/33de27H""><span class=""tco-ellipsis""></span><span class=""invisible"">https://</span><span class=""js-display-url"">cnn.it/33de27H</span><span class=""invisible""></span><span class=""tco-ellipsis""><span class=""invisible""> </span></span></a><a class=""twitter-timeline-link u-hidden"" data-pre-embedded=""true"" dir=""ltr"" href=""https://t.co/ZIXRuSbS6L"">pic.twitter.com/ZIXRuSbS6L</a></p>","['https://cnn.it/33oOiFH', 'https://cnn.it/2xyVuDa', 'https://cnn.it/2WaEkFZ', 'https://cnn.it/33de27H']",[],True,['https://pbs.twimg.com/media/ES8Lf-CWsAghP3S.jpg'],,399,150,86,True,False,,[]
142,CNN,CNN,759251,1238206197897052166,/CNN/status/1238206197897052166,2020-03-12 20:52:16,1584046336,"Republican Sen. Lindsey Graham of South Carolina, a close ally of President Trump, has become the latest member of Congress to announce that he is self-quarantining amid the coronavirus outbreak https://cnn.it/2vmr8mI ","<p class=""TweetTextSize js-tweet-text tweet-text"" data-aria-label-part=""0"" lang=""en"">Republican Sen. Lindsey Graham of South Carolina, a close ally of President Trump, has become the latest member of Congress to announce that he is self-quarantining amid the <strong>coronavirus</strong> outbreak <a class=""twitter-timeline-link u-hidden"" data-expanded-url=""https://cnn.it/2vmr8mI"" dir=""ltr"" href=""https://t.co/4XcbW0QOK2"" rel=""nofollow noopener"" target=""_blank"" title=""https://cnn.it/2vmr8mI""><span class=""tco-ellipsis""></span><span class=""invisible"">https://</span><span class=""js-display-url"">cnn.it/2vmr8mI</span><span class=""invisible""></span><span class=""tco-ellipsis""><span class=""invisible""> </span></span></a></p>",['https://cnn.it/2vmr8mI'],[],False,[],,2861,945,1147,True,False,,[]
143,CNN,CNN,759251,1238204038556106763,/CNN/status/1238204038556106763,2020-03-12 20:43:42,1584045822,"Disneyland in Anaheim, California, is closing due to the coronavirus outbreak. The closure follows Disney shuttering some of its parks overseas because of the virus. https://cnn.it/3cO5JUl ","<p class=""TweetTextSize js-tweet-text tweet-text"" data-aria-label-part=""0"" lang=""en"">Disneyland in Anaheim, California, is closing due to the <strong>coronavirus</strong> outbreak. The closure follows Disney shuttering some of its parks overseas because of the virus. <a class=""twitter-timeline-link u-hidden"" data-expanded-url=""https://cnn.it/3cO5JUl"" dir=""ltr"" href=""https://t.co/K4G2JdDrfU"" rel=""nofollow noopener"" target=""_blank"" title=""https://cnn.it/3cO5JUl""><span class=""tco-ellipsis""></span><span class=""invisible"">https://</span><span class=""js-display-url"">cnn.it/3cO5JUl</span><span class=""invisible""></span><span class=""tco-ellipsis""><span class=""invisible""> </span></span></a></p>",['https://cnn.it/3cO5JUl'],[],False,[],,1733,943,96,True,False,,[]
144,CNN,CNN,759251,1238200278396125194,/CNN/status/1238200278396125194,2020-03-12 20:28:45,1584044925,"JUST IN: US stocks just recorded their worst day since the 1987 crash, on rising fears about the coronavirus pandemic. The Dow closed down more than 2,300 points, or nearly 10%. https://cnn.it/3cTVhL6 pic.twitter.com/qmWHPMuoO9","<p class=""TweetTextSize js-tweet-text tweet-text"" data-aria-label-part=""0"" lang=""en"">JUST IN: US stocks just recorded their worst day since the 1987 crash, on rising fears about the <strong>coronavirus</strong> pandemic. The Dow closed down more than 2,300 points, or nearly 10%. <a class=""twitter-timeline-link"" data-expanded-url=""https://cnn.it/3cTVhL6"" dir=""ltr"" href=""https://t.co/zYFKvHKJcC"" rel=""nofollow noopener"" target=""_blank"" title=""https://cnn.it/3cTVhL6""><span class=""tco-ellipsis""></span><span class=""invisible"">https://</span><span class=""js-display-url"">cnn.it/3cTVhL6</span><span class=""invisible""></span><span class=""tco-ellipsis""><span class=""invisible""> </span></span></a><a class=""twitter-timeline-link u-hidden"" data-pre-embedded=""true"" dir=""ltr"" href=""https://t.co/qmWHPMuoO9"">pic.twitter.com/qmWHPMuoO9</a></p>",['https://cnn.it/3cTVhL6'],[],True,['https://pbs.twimg.com/media/ES74lycXQAw23Y-.png'],,632,374,90,True,False,,[]
145,CNN,CNN,759251,1222663493603799040,/CNN/status/1222663493603799040,2020-01-29 23:31:07,1580340667,"Countries are scrambling to evacuate their citizens from Wuhan, the epicenter of the novel coronavirus outbreak in Hubei province, as the number of cases overtake the 2003 SARS outbreak inside mainland China https://cnn.it/2Gy5cHh ","<p class=""TweetTextSize js-tweet-text tweet-text"" data-aria-label-part=""0"" lang=""en"">Countries are scrambling to evacuate their citizens from Wuhan, the epicenter of the novel <strong>coronavirus</strong> outbreak in Hubei province, as the number of cases overtake the 2003 SARS outbreak inside mainland China <a class=""twitter-timeline-link u-hidden"" data-expanded-url=""https://cnn.it/2Gy5cHh"" dir=""ltr"" href=""https://t.co/4F0rbDMGlH"" rel=""nofollow noopener"" target=""_blank"" title=""https://cnn.it/2Gy5cHh""><span class=""tco-ellipsis""></span><span class=""invisible"">https://</span><span class=""js-display-url"">cnn.it/2Gy5cHh</span><span class=""invisible""></span><span class=""tco-ellipsis""><span class=""invisible""> </span></span></a></p>",['https://cnn.it/2Gy5cHh'],[],False,[],,120,63,23,True,False,,[]
146,CNN,CNN,759251,1222659059528192000,/CNN/status/1222659059528192000,2020-01-29 23:13:30,1580339610,"There are now at least 162 dead from Wuhan coronavirus in China’s Hubei province – the epicenter of the outbreak – and a total of 4,586 confirmed cases in the province by the end of Wednesday, according to Hubei’s provincial health authority https://cnn.it/36Fd2Ju ","<p class=""TweetTextSize js-tweet-text tweet-text"" data-aria-label-part=""0"" lang=""en"">There are now at least 162 dead from Wuhan <strong>coronavirus</strong> in China’s Hubei province – the epicenter of the outbreak – and a total of 4,586 confirmed cases in the province by the end of Wednesday, according to Hubei’s provincial health authority <a class=""twitter-timeline-link u-hidden"" data-expanded-url=""https://cnn.it/36Fd2Ju"" dir=""ltr"" href=""https://t.co/h0S1PLxCWm"" rel=""nofollow noopener"" target=""_blank"" title=""https://cnn.it/36Fd2Ju""><span class=""tco-ellipsis""></span><span class=""invisible"">https://</span><span class=""js-display-url"">cnn.it/36Fd2Ju</span><span class=""invisible""></span><span class=""tco-ellipsis""><span class=""invisible""> </span></span></a></p>",['https://cnn.it/36Fd2Ju'],[],False,[],,193,135,24,True,False,,[]
147,CNN,CNN,759251,1222656856914636809,/CNN/status/1222656856914636809,2020-01-29 23:04:45,1580339085,"Chad Wolf, the acting Homeland Security secretary, said enhanced coronavirus screening has expanded to 20 airports, including Miami, which is hosting Super Bowl LIV https://cnn.it/2RDh7K4 ","<p class=""TweetTextSize js-tweet-text tweet-text"" data-aria-label-part=""0"" lang=""en"">Chad Wolf, the acting Homeland Security secretary, said enhanced <strong>coronavirus</strong> screening has expanded to 20 airports, including Miami, which is hosting Super Bowl LIV <a class=""twitter-timeline-link u-hidden"" data-expanded-url=""https://cnn.it/2RDh7K4"" dir=""ltr"" href=""https://t.co/UAzu7fFbv6"" rel=""nofollow noopener"" target=""_blank"" title=""https://cnn.it/2RDh7K4""><span class=""tco-ellipsis""></span><span class=""invisible"">https://</span><span class=""js-display-url"">cnn.it/2RDh7K4</span><span class=""invisible""></span><span class=""tco-ellipsis""><span class=""invisible""> </span></span></a></p>",['https://cnn.it/2RDh7K4'],[],False,[],,134,54,9,True,False,,[]
