,screen_name,username,user_id,tweet_id,tweet_url,timestamp,timestamp_epochs,text,text_html,links,hashtags,has_media,img_urls,video_url,likes,retweets,replies,is_replied,is_reply_to,parent_tweet_id,reply_to_users
215,CNN,CNN,759251,1236683168343830536,/CNN/status/1236683168343830536,2020-03-08 16:00:18,1583683218,Days ago there was one confirmed US coronavirus death. Now it has killed 19 people and affected more than 30 states. Here's how the outbreak evolved. https://cnn.it/38zj0g6 ,"<p class=""TweetTextSize js-tweet-text tweet-text"" data-aria-label-part=""0"" lang=""en"">Days ago there was one confirmed US <strong>coronavirus</strong> death. Now it has killed 19 people and affected more than 30 states. Here's how the outbreak evolved. <a class=""twitter-timeline-link u-hidden"" data-expanded-url=""https://cnn.it/38zj0g6"" dir=""ltr"" href=""https://t.co/ReL2bmE5gh"" rel=""nofollow noopener"" target=""_blank"" title=""https://cnn.it/38zj0g6""><span class=""tco-ellipsis""></span><span class=""invisible"">https://</span><span class=""js-display-url"">cnn.it/38zj0g6</span><span class=""invisible""></span><span class=""tco-ellipsis""><span class=""invisible""> </span></span></a></p>",['https://cnn.it/38zj0g6'],[],False,[],,265,133,41,True,False,,[]
216,CNN,CNN,759251,1236675591442751489,/CNN/status/1236675591442751489,2020-03-08 15:30:11,1583681411,The Italian Prime Minister has signed a decree that will restrict travel for millions of people because of the coronavirus https://cnn.it/2Tz4ZLi ,"<p class=""TweetTextSize js-tweet-text tweet-text"" data-aria-label-part=""0"" lang=""en"">The Italian Prime Minister has signed a decree that will restrict travel for millions of people because of the <strong>coronavirus</strong> <a class=""twitter-timeline-link u-hidden"" data-expanded-url=""https://cnn.it/2Tz4ZLi"" dir=""ltr"" href=""https://t.co/qp9CJft8sA"" rel=""nofollow noopener"" target=""_blank"" title=""https://cnn.it/2Tz4ZLi""><span class=""tco-ellipsis""></span><span class=""invisible"">https://</span><span class=""js-display-url"">cnn.it/2Tz4ZLi</span><span class=""invisible""></span><span class=""tco-ellipsis""><span class=""invisible""> </span></span></a></p>",['https://cnn.it/2Tz4ZLi'],[],False,[],,505,206,34,True,False,,[]
217,CNN,CNN,759251,1236653666838499329,/CNN/status/1236653666838499329,2020-03-08 14:03:04,1583676184,"China's air pollutant levels dropped in February as a result of measures taken by the nation's government to reduce the risk of spreading coronavirus, the Copernicus Atmosphere Monitoring Service confirmed https://cnn.it/2Iuuffd ","<p class=""TweetTextSize js-tweet-text tweet-text"" data-aria-label-part=""0"" lang=""en"">China's air pollutant levels dropped in February as a result of measures taken by the nation's government to reduce the risk of spreading <strong>coronavirus</strong>, the Copernicus Atmosphere Monitoring Service confirmed <a class=""twitter-timeline-link u-hidden"" data-expanded-url=""https://cnn.it/2Iuuffd"" dir=""ltr"" href=""https://t.co/THVcTYSpEG"" rel=""nofollow noopener"" target=""_blank"" title=""https://cnn.it/2Iuuffd""><span class=""tco-ellipsis""></span><span class=""invisible"">https://</span><span class=""js-display-url"">cnn.it/2Iuuffd</span><span class=""invisible""></span><span class=""tco-ellipsis""><span class=""invisible""> </span></span></a></p>",['https://cnn.it/2Iuuffd'],[],False,[],,405,139,28,True,False,,[]
218,CNN,CNN,759251,1236653179162460160,/CNN/status/1236653179162460160,2020-03-08 14:01:08,1583676068,Satellite images recently released by NASA and the European Space Agency reveal that air pollution over China has gone down since the coronavirus outbreak https://cnn.it/39Aq2mb ,"<p class=""TweetTextSize js-tweet-text tweet-text"" data-aria-label-part=""0"" lang=""en"">Satellite images recently released by NASA and the European Space Agency reveal that air pollution over China has gone down since the <strong>coronavirus</strong> outbreak <a class=""twitter-timeline-link u-hidden"" data-expanded-url=""https://cnn.it/39Aq2mb"" dir=""ltr"" href=""https://t.co/wwlVkqWGE8"" rel=""nofollow noopener"" target=""_blank"" title=""https://cnn.it/39Aq2mb""><span class=""tco-ellipsis""></span><span class=""invisible"">https://</span><span class=""js-display-url"">cnn.it/39Aq2mb</span><span class=""invisible""></span><span class=""tco-ellipsis""><span class=""invisible""> </span></span></a></p>",['https://cnn.it/39Aq2mb'],[],False,[],,979,310,69,True,False,,[]
219,CNN,CNN,759251,1236630516666949633,/CNN/status/1236630516666949633,2020-03-08 12:31:05,1583670665,"The best protection against coronavirus is washing your hands -- but you have to do it properly:

  Wet your hands

  Lather, making sure to get soap in all the nooks and crannies 

  Scrub for *20 seconds*

  Rinse and *dry thoroughly*

https://cnn.it/3cCrV3L ","<p class=""TweetTextSize js-tweet-text tweet-text"" data-aria-label-part=""0"" lang=""en"">The best protection against <strong>coronavirus</strong> is washing your hands -- but you have to do it properly:

<img alt=""🚿"" aria-label=""Emoji: Ducha"" class=""Emoji Emoji--forText"" draggable=""false"" src=""https://abs.twimg.com/emoji/v2/72x72/1f6bf.png"" title=""Ducha""/>  Wet your hands

<img alt=""🚿"" aria-label=""Emoji: Ducha"" class=""Emoji Emoji--forText"" draggable=""false"" src=""https://abs.twimg.com/emoji/v2/72x72/1f6bf.png"" title=""Ducha""/>  Lather, making sure to get soap in all the nooks and crannies 

<img alt=""🚿"" aria-label=""Emoji: Ducha"" class=""Emoji Emoji--forText"" draggable=""false"" src=""https://abs.twimg.com/emoji/v2/72x72/1f6bf.png"" title=""Ducha""/>  Scrub for *20 seconds*

<img alt=""🚿"" aria-label=""Emoji: Ducha"" class=""Emoji Emoji--forText"" draggable=""false"" src=""https://abs.twimg.com/emoji/v2/72x72/1f6bf.png"" title=""Ducha""/>  Rinse and *dry thoroughly*

<a class=""twitter-timeline-link u-hidden"" data-expanded-url=""https://cnn.it/3cCrV3L"" dir=""ltr"" href=""https://t.co/e9cScwtXcD"" rel=""nofollow noopener"" target=""_blank"" title=""https://cnn.it/3cCrV3L""><span class=""tco-ellipsis""></span><span class=""invisible"">https://</span><span class=""js-display-url"">cnn.it/3cCrV3L</span><span class=""invisible""></span><span class=""tco-ellipsis""><span class=""invisible""> </span></span></a></p>",['https://cnn.it/3cCrV3L'],[],False,[],,1722,951,136,True,False,,[]
220,CNN,CNN,759251,1236619181984043008,/CNN/status/1236619181984043008,2020-03-08 11:46:02,1583667962,Starbucks has announced it is temporarily suspending the use of personal cups and tumblers at its stores to help prevent the spread of coronavirus https://cnn.it/2wB95t8 ,"<p class=""TweetTextSize js-tweet-text tweet-text"" data-aria-label-part=""0"" lang=""en"">Starbucks has announced it is temporarily suspending the use of personal cups and tumblers at its stores to help prevent the spread of <strong>coronavirus</strong> <a class=""twitter-timeline-link u-hidden"" data-expanded-url=""https://cnn.it/2wB95t8"" dir=""ltr"" href=""https://t.co/ikHCUTJZmR"" rel=""nofollow noopener"" target=""_blank"" title=""https://cnn.it/2wB95t8""><span class=""tco-ellipsis""></span><span class=""invisible"">https://</span><span class=""js-display-url"">cnn.it/2wB95t8</span><span class=""invisible""></span><span class=""tco-ellipsis""><span class=""invisible""> </span></span></a></p>",['https://cnn.it/2wB95t8'],[],False,[],,441,159,49,True,False,,[]
221,CNN,CNN,759251,1236607864313184262,/CNN/status/1236607864313184262,2020-03-08 11:01:04,1583665264,"The US government is urging people who are sick to stay at home to help prevent the spread of coronavirus.

But for workers who don't have paid sick leave, staying home when they aren't feeling well can be financially devastating. https://cnn.it/2It8MU3 ","<p class=""TweetTextSize js-tweet-text tweet-text"" data-aria-label-part=""0"" lang=""en"">The US government is urging people who are sick to stay at home to help prevent the spread of <strong>coronavirus</strong>.

But for workers who don't have paid sick leave, staying home when they aren't feeling well can be financially devastating. <a class=""twitter-timeline-link u-hidden"" data-expanded-url=""https://cnn.it/2It8MU3"" dir=""ltr"" href=""https://t.co/wTLqB6gWdV"" rel=""nofollow noopener"" target=""_blank"" title=""https://cnn.it/2It8MU3""><span class=""tco-ellipsis""></span><span class=""invisible"">https://</span><span class=""js-display-url"">cnn.it/2It8MU3</span><span class=""invisible""></span><span class=""tco-ellipsis""><span class=""invisible""> </span></span></a></p>",['https://cnn.it/2It8MU3'],[],False,[],,1144,483,160,True,False,,[]
222,CNN,CNN,759251,1239702656790257670,/CNN/status/1239702656790257670,2020-03-16 23:58:40,1584403120,"""Saturday Night Live"" will not return from hiatus until further notice because of the coronavirus https://cnn.it/2QkXq8C ","<p class=""TweetTextSize js-tweet-text tweet-text"" data-aria-label-part=""0"" lang=""en"">""Saturday Night Live"" will not return from hiatus until further notice because of the <strong>coronavirus</strong> <a class=""twitter-timeline-link u-hidden"" data-expanded-url=""https://cnn.it/2QkXq8C"" dir=""ltr"" href=""https://t.co/SE1eguQHly"" rel=""nofollow noopener"" target=""_blank"" title=""https://cnn.it/2QkXq8C""><span class=""tco-ellipsis""></span><span class=""invisible"">https://</span><span class=""js-display-url"">cnn.it/2QkXq8C</span><span class=""invisible""></span><span class=""tco-ellipsis""><span class=""invisible""> </span></span></a></p>",['https://cnn.it/2QkXq8C'],[],False,[],,1054,275,293,True,False,,[]
223,CNN,CNN,759251,1239701403263741953,/CNN/status/1239701403263741953,2020-03-16 23:53:41,1584402821,"NASCAR has announced that it is postponing all races through May 3 with plans to return to competition in Martinsville, Virginia, due to concerns over coronavirus. NASCAR also said it still intends to hold all 36 of its planned races this season. https://cnn.it/3aZoLoN ","<p class=""TweetTextSize js-tweet-text tweet-text"" data-aria-label-part=""0"" lang=""en"">NASCAR has announced that it is postponing all races through May 3 with plans to return to competition in Martinsville, Virginia, due to concerns over <strong>coronavirus</strong>. NASCAR also said it still intends to hold all 36 of its planned races this season. <a class=""twitter-timeline-link u-hidden"" data-expanded-url=""https://cnn.it/3aZoLoN"" dir=""ltr"" href=""https://t.co/sf81aXYFvT"" rel=""nofollow noopener"" target=""_blank"" title=""https://cnn.it/3aZoLoN""><span class=""tco-ellipsis""></span><span class=""invisible"">https://</span><span class=""js-display-url"">cnn.it/3aZoLoN</span><span class=""invisible""></span><span class=""tco-ellipsis""><span class=""invisible""> </span></span></a></p>",['https://cnn.it/3aZoLoN'],[],False,[],,155,61,16,True,False,,[]
224,CNN,CNN,759251,1239695629812666370,/CNN/status/1239695629812666370,2020-03-16 23:30:45,1584401445,"Tom Hanks and his wife, Rita Wilson, have left the hospital and are now self-quarantined at their residence in Australia as they continue to recover from novel coronavirus, a representative for Hanks told CNN https://cnn.it/2U9jd4x ","<p class=""TweetTextSize js-tweet-text tweet-text"" data-aria-label-part=""0"" lang=""en"">Tom Hanks and his wife, Rita Wilson, have left the hospital and are now self-quarantined at their residence in Australia as they continue to recover from novel <strong>coronavirus</strong>, a representative for Hanks told CNN <a class=""twitter-timeline-link u-hidden"" data-expanded-url=""https://cnn.it/2U9jd4x"" dir=""ltr"" href=""https://t.co/TIAbXhlZAv"" rel=""nofollow noopener"" target=""_blank"" title=""https://cnn.it/2U9jd4x""><span class=""tco-ellipsis""></span><span class=""invisible"">https://</span><span class=""js-display-url"">cnn.it/2U9jd4x</span><span class=""invisible""></span><span class=""tco-ellipsis""><span class=""invisible""> </span></span></a></p>",['https://cnn.it/2U9jd4x'],[],False,[],,3255,494,121,True,False,,[]
225,CNN,CNN,759251,1239695197216354312,/CNN/status/1239695197216354312,2020-03-16 23:29:02,1584401342,"Regal Cinemas has announced the closure, starting Tuesday, of all of its theaters until further notice as a result of the coronavirus outbreak https://cnn.it/2Ql86UN ","<p class=""TweetTextSize js-tweet-text tweet-text"" data-aria-label-part=""0"" lang=""en"">Regal Cinemas has announced the closure, starting Tuesday, of all of its theaters until further notice as a result of the <strong>coronavirus</strong> outbreak <a class=""twitter-timeline-link u-hidden"" data-expanded-url=""https://cnn.it/2Ql86UN"" dir=""ltr"" href=""https://t.co/k3ljI0ZaNs"" rel=""nofollow noopener"" target=""_blank"" title=""https://cnn.it/2Ql86UN""><span class=""tco-ellipsis""></span><span class=""invisible"">https://</span><span class=""js-display-url"">cnn.it/2Ql86UN</span><span class=""invisible""></span><span class=""tco-ellipsis""><span class=""invisible""> </span></span></a></p>",['https://cnn.it/2Ql86UN'],[],False,[],,562,254,24,True,False,,[]
226,CNN,CNN,759251,1239694708693241856,/CNN/status/1239694708693241856,2020-03-16 23:27:05,1584401225,Minnesota Gov. Tim Walz has signed an executive order requiring the temporary closure of all restaurants and bars to dine-in customers to prevent further spread of the coronavirus https://cnn.it/3aZmolT ,"<p class=""TweetTextSize js-tweet-text tweet-text"" data-aria-label-part=""0"" lang=""en"">Minnesota Gov. Tim Walz has signed an executive order requiring the temporary closure of all restaurants and bars to dine-in customers to prevent further spread of the <strong>coronavirus</strong> <a class=""twitter-timeline-link u-hidden"" data-expanded-url=""https://cnn.it/3aZmolT"" dir=""ltr"" href=""https://t.co/bOsVQ2kfGv"" rel=""nofollow noopener"" target=""_blank"" title=""https://cnn.it/3aZmolT""><span class=""tco-ellipsis""></span><span class=""invisible"">https://</span><span class=""js-display-url"">cnn.it/3aZmolT</span><span class=""invisible""></span><span class=""tco-ellipsis""><span class=""invisible""> </span></span></a></p>",['https://cnn.it/3aZmolT'],[],False,[],,220,95,13,True,False,,[]
227,CNN,CNN,759251,1239694012723998720,/CNN/status/1239694012723998720,2020-03-16 23:24:19,1584401059,"Despite concerns about large groups of people being together in the midst of the coronavirus outbreak, officials in Arizona say they will not be postponing the state's presidential primary, scheduled for Tuesday https://cnn.it/2IS8nKR ","<p class=""TweetTextSize js-tweet-text tweet-text"" data-aria-label-part=""0"" lang=""en"">Despite concerns about large groups of people being together in the midst of the <strong>coronavirus</strong> outbreak, officials in Arizona say they will not be postponing the state's presidential primary, scheduled for Tuesday <a class=""twitter-timeline-link u-hidden"" data-expanded-url=""https://cnn.it/2IS8nKR"" dir=""ltr"" href=""https://t.co/EUHlDFPfm6"" rel=""nofollow noopener"" target=""_blank"" title=""https://cnn.it/2IS8nKR""><span class=""tco-ellipsis""></span><span class=""invisible"">https://</span><span class=""js-display-url"">cnn.it/2IS8nKR</span><span class=""invisible""></span><span class=""tco-ellipsis""><span class=""invisible""> </span></span></a></p>",['https://cnn.it/2IS8nKR'],[],False,[],,176,62,35,True,False,,[]
228,CNN,CNN,759251,1239693203902775297,/CNN/status/1239693203902775297,2020-03-16 23:21:06,1584400866,"With governments and central banks in Europe and North America pursuing drastic measures to try to control the coronavirus, Asia still on high alert, and financial markets in meltdown, a growing number of experts say that a global contraction is beginning https://cnn.it/33qgWG5 ","<p class=""TweetTextSize js-tweet-text tweet-text"" data-aria-label-part=""0"" lang=""en"">With governments and central banks in Europe and North America pursuing drastic measures to try to control the <strong>coronavirus</strong>, Asia still on high alert, and financial markets in meltdown, a growing number of experts say that a global contraction is beginning <a class=""twitter-timeline-link u-hidden"" data-expanded-url=""https://cnn.it/33qgWG5"" dir=""ltr"" href=""https://t.co/KKiKT84CLw"" rel=""nofollow noopener"" target=""_blank"" title=""https://cnn.it/33qgWG5""><span class=""tco-ellipsis""></span><span class=""invisible"">https://</span><span class=""js-display-url"">cnn.it/33qgWG5</span><span class=""invisible""></span><span class=""tco-ellipsis""><span class=""invisible""> </span></span></a></p>",['https://cnn.it/33qgWG5'],[],False,[],,200,109,19,True,False,,[]
229,CNN,CNN,759251,1239693186727063553,/CNN/status/1239693186727063553,2020-03-16 23:21:02,1584400862,The domestic box office just had its worst weekend in two decades amid the coronavirus crisis. And it's about to get a lot worse. https://cnn.it/2TUrUAx ,"<p class=""TweetTextSize js-tweet-text tweet-text"" data-aria-label-part=""0"" lang=""en"">The domestic box office just had its worst weekend in two decades amid the <strong>coronavirus</strong> crisis. And it's about to get a lot worse. <a class=""twitter-timeline-link u-hidden"" data-expanded-url=""https://cnn.it/2TUrUAx"" dir=""ltr"" href=""https://t.co/U0Yj0UoB3J"" rel=""nofollow noopener"" target=""_blank"" title=""https://cnn.it/2TUrUAx""><span class=""tco-ellipsis""></span><span class=""invisible"">https://</span><span class=""js-display-url"">cnn.it/2TUrUAx</span><span class=""invisible""></span><span class=""tco-ellipsis""><span class=""invisible""> </span></span></a></p>",['https://cnn.it/2TUrUAx'],[],False,[],,194,65,37,True,False,,[]
230,CNN,CNN,759251,1239692542456795136,/CNN/status/1239692542456795136,2020-03-16 23:18:29,1584400709,"Republican Ohio Gov. Mike DeWine announced that he is recommending moving the state's primary election, slated to take place on Tuesday, to June over fears around the novel coronavirus https://cnn.it/2TV4bQT ","<p class=""TweetTextSize js-tweet-text tweet-text"" data-aria-label-part=""0"" lang=""en"">Republican Ohio Gov. Mike DeWine announced that he is recommending moving the state's primary election, slated to take place on Tuesday, to June over fears around the novel <strong>coronavirus</strong> <a class=""twitter-timeline-link u-hidden"" data-expanded-url=""https://cnn.it/2TV4bQT"" dir=""ltr"" href=""https://t.co/ae6gF6KBW1"" rel=""nofollow noopener"" target=""_blank"" title=""https://cnn.it/2TV4bQT""><span class=""tco-ellipsis""></span><span class=""invisible"">https://</span><span class=""js-display-url"">cnn.it/2TV4bQT</span><span class=""invisible""></span><span class=""tco-ellipsis""><span class=""invisible""> </span></span></a></p>",['https://cnn.it/2TV4bQT'],[],False,[],,145,41,57,True,False,,[]
231,CNN,CNN,759251,1239692273362796547,/CNN/status/1239692273362796547,2020-03-16 23:17:24,1584400644,"The head of USAID will step down, Secretary of State Mike Pompeo has announced. Mark Green's departure, which sources at USAID say has been long planned, comes as the US ramps up its domestic and international response to the coronavirus pandemic. https://cnn.it/2Qksg1q ","<p class=""TweetTextSize js-tweet-text tweet-text"" data-aria-label-part=""0"" lang=""en"">The head of USAID will step down, Secretary of State Mike Pompeo has announced. Mark Green's departure, which sources at USAID say has been long planned, comes as the US ramps up its domestic and international response to the <strong>coronavirus</strong> pandemic. <a class=""twitter-timeline-link u-hidden"" data-expanded-url=""https://cnn.it/2Qksg1q"" dir=""ltr"" href=""https://t.co/4dr8bwSJPq"" rel=""nofollow noopener"" target=""_blank"" title=""https://cnn.it/2Qksg1q""><span class=""tco-ellipsis""></span><span class=""invisible"">https://</span><span class=""js-display-url"">cnn.it/2Qksg1q</span><span class=""invisible""></span><span class=""tco-ellipsis""><span class=""invisible""> </span></span></a></p>",['https://cnn.it/2Qksg1q'],[],False,[],,121,67,27,True,False,,[]
232,CNN,CNN,759251,1239685649885810691,/CNN/status/1239685649885810691,2020-03-16 22:51:05,1584399065,The National Park Service has temporarily suspended operations at the Statue of Liberty National Monument and Ellis Island in response to the coronavirus outbreak https://cnn.it/2QBezLN ,"<p class=""TweetTextSize js-tweet-text tweet-text"" data-aria-label-part=""0"" lang=""en"">The National Park Service has temporarily suspended operations at the Statue of Liberty National Monument and Ellis Island in response to the <strong>coronavirus</strong> outbreak <a class=""twitter-timeline-link u-hidden"" data-expanded-url=""https://cnn.it/2QBezLN"" dir=""ltr"" href=""https://t.co/74lTdrsmDR"" rel=""nofollow noopener"" target=""_blank"" title=""https://cnn.it/2QBezLN""><span class=""tco-ellipsis""></span><span class=""invisible"">https://</span><span class=""js-display-url"">cnn.it/2QBezLN</span><span class=""invisible""></span><span class=""tco-ellipsis""><span class=""invisible""> </span></span></a></p>",['https://cnn.it/2QBezLN'],[],False,[],,244,93,15,True,False,,[]
233,CNN,CNN,759251,1239683124616990727,/CNN/status/1239683124616990727,2020-03-16 22:41:03,1584398463,"The Pentagon is attempting to create a ""bubble"" around its top two officials by keeping them ""physically separated"" as a precaution against the coronavirus pandemic, a Defense Department spokesperson says https://cnn.it/2UauGAO ","<p class=""TweetTextSize js-tweet-text tweet-text"" data-aria-label-part=""0"" lang=""en"">The Pentagon is attempting to create a ""bubble"" around its top two officials by keeping them ""physically separated"" as a precaution against the <strong>coronavirus</strong> pandemic, a Defense Department spokesperson says <a class=""twitter-timeline-link u-hidden"" data-expanded-url=""https://cnn.it/2UauGAO"" dir=""ltr"" href=""https://t.co/mikYmM4KHu"" rel=""nofollow noopener"" target=""_blank"" title=""https://cnn.it/2UauGAO""><span class=""tco-ellipsis""></span><span class=""invisible"">https://</span><span class=""js-display-url"">cnn.it/2UauGAO</span><span class=""invisible""></span><span class=""tco-ellipsis""><span class=""invisible""> </span></span></a></p>",['https://cnn.it/2UauGAO'],[],False,[],,206,77,33,True,False,,[]
234,CNN,CNN,759251,1239680629769474048,/CNN/status/1239680629769474048,2020-03-16 22:31:08,1584397868,"As the coronavirus pandemic disrupts travel around the world, customers booking through third-party sites are struggling to get assistance and refunds. Here's what you need to know. https://cnn.it/2QkO0tM ","<p class=""TweetTextSize js-tweet-text tweet-text"" data-aria-label-part=""0"" lang=""en"">As the <strong>coronavirus</strong> pandemic disrupts travel around the world, customers booking through third-party sites are struggling to get assistance and refunds. Here's what you need to know. <a class=""twitter-timeline-link u-hidden"" data-expanded-url=""https://cnn.it/2QkO0tM"" dir=""ltr"" href=""https://t.co/WwojZzRMPI"" rel=""nofollow noopener"" target=""_blank"" title=""https://cnn.it/2QkO0tM""><span class=""tco-ellipsis""></span><span class=""invisible"">https://</span><span class=""js-display-url"">cnn.it/2QkO0tM</span><span class=""invisible""></span><span class=""tco-ellipsis""><span class=""invisible""> </span></span></a></p>",['https://cnn.it/2QkO0tM'],[],False,[],,246,99,23,True,False,,[]
235,CNN,CNN,759251,1239680628225904640,/CNN/status/1239680628225904640,2020-03-16 22:31:08,1584397868,"Customers booking through third-party site such as Expedia, http://Booking.com  and Orbitz are struggling to get assistance and refunds as the coronavirus pandemic disrupts travelers' plans around the world. Here's what you need to know. https://cnn.it/3d5fsFS ","<p class=""TweetTextSize js-tweet-text tweet-text"" data-aria-label-part=""0"" lang=""en"">Customers booking through third-party site such as Expedia, <a class=""twitter-timeline-link"" data-expanded-url=""http://Booking.com"" dir=""ltr"" href=""https://t.co/uWB5fGTGF9"" rel=""nofollow noopener"" target=""_blank"" title=""http://Booking.com""><span class=""tco-ellipsis""></span><span class=""invisible"">http://</span><span class=""js-display-url"">Booking.com</span><span class=""invisible""></span><span class=""tco-ellipsis""><span class=""invisible""> </span></span></a> and Orbitz are struggling to get assistance and refunds as the <strong>coronavirus</strong> pandemic disrupts travelers' plans around the world. Here's what you need to know. <a class=""twitter-timeline-link"" data-expanded-url=""https://cnn.it/3d5fsFS"" dir=""ltr"" href=""https://t.co/ZJhw9NABB8"" rel=""nofollow noopener"" target=""_blank"" title=""https://cnn.it/3d5fsFS""><span class=""tco-ellipsis""></span><span class=""invisible"">https://</span><span class=""js-display-url"">cnn.it/3d5fsFS</span><span class=""invisible""></span><span class=""tco-ellipsis""><span class=""invisible""> </span></span></a></p>","['http://Booking.com', 'https://cnn.it/3d5fsFS']",[],False,[],,150,67,24,True,False,,[]
